name,status,priority,created
Aliquid ad provident voluptatem facilis.,done,medium,2022.05.02 19:44:59
Soluta harum porro laboriosam qui.,done,medium,2022.12.21 15:38:39
Cumque vitae deleniti.,open,low,2022.03.10 16:42:51
Quibusdam iure nam exercitationem minima.,done,high,2022.06.14 08:14:02
Facilis at suscipit illum.,done,medium,2022.10.04 04:16:22
Minus reiciendis ipsam nesciunt et.,done,medium,2022.10.27 19:07:30
Molestiae rerum et.,open,low,2022.10.13 03:41:07
At pariatur neque doloremque.,open,low,2022.03.19 14:03:53
Earum exercitationem illo.,open,medium,2022.08.23 20:26:42
Laudantium accusamus reiciendis.,open,high,2022.01.31 17:35:37
Veniam culpa optio ipsum atque.,done,low,2022.09.27 11:02:33
Necessitatibus labore corporis.,done,low,2023.01.11 22:18:13
Eveniet quibusdam cumque veniam.,open,medium,2022.11.16 14:31:04
Nostrum alias dolore ipsa non.,open,medium,2022.06.03 11:32:23
Quos dolorem sequi sint.,open,high,2022.03.31 15:00:46
Deserunt provident nisi recusandae voluptate.,done,medium,2022.08.07 01:48:40
Cum laborum dolorum.,open,high,2022.07.27 00:00:04
Dolor ipsum odit debitis tenetur.,done,high,2022.06.08 21:10:03
Suscipit voluptatum voluptas eius.,open,medium,2023.01.04 07:22:12
Aliquam iure optio laudantium labore.,done,high,2022.07.21 23:42:41
Explicabo delectus magnam at quos.,open,medium,2022.10.04 01:45:10
Enim animi nobis quam corporis.,open,high,2022.12.05 01:32:01
Qui natus quia similique.,open,low,2022.09.11 18:31:49
Porro vero dicta.,open,medium,2022.05.13 17:40:01
Reprehenderit iste natus.,done,low,2022.12.13 12:24:25
Aliquam provident aperiam.,done,medium,2022.02.27 00:08:43
Aliquam mollitia modi dolor.,done,medium,2022.12.07 16:40:39
Sequi facilis incidunt minus.,done,high,2022.12.08 22:44:15
Enim hic at.,open,high,2022.06.03 21:55:42
Amet cum temporibus magni.,open,medium,2022.05.17 22:06:27
Pariatur quia dolores.,open,medium,2022.04.13 03:53:32
Sapiente cupiditate consequatur.,done,high,2022.02.28 10:20:03
Libero voluptatum itaque.,open,low,2022.10.20 13:38:21
Dicta sunt impedit aut ipsa.,done,low,2022.10.26 05:15:24
Cumque eligendi facere asperiores.,done,medium,2022.11.05 10:46:26
Doloremque id adipisci natus.,done,low,2022.02.19 05:24:01
Eos soluta eligendi maxime.,done,high,2022.07.27 02:18:34
