name,status,priority,created
Dolorum odio deleniti sapiente maxime.,done,high,2022.02.24 02:51:43
Pariatur itaque assumenda quisquam.,open,low,2022.08.24 00:26:09
Beatae ducimus expedita.,done,low,2022.04.24 12:03:37
A omnis id.,open,low,2022.09.27 11:52:57
Non quibusdam deleniti recusandae adipisci.,open,medium,2022.11.14 14:01:11
Ipsa eos possimus accusamus a.,open,low,2022.02.10 13:57:40
Cupiditate impedit fuga.,done,medium,2022.04.10 00:21:49
Eum eaque necessitatibus molestiae.,open,high,2022.02.04 02:28:05
Aut culpa temporibus a voluptate.,open,high,2022.02.25 07:37:12
Vero possimus expedita.,done,medium,2022.10.01 22:52:08
Officia eligendi facilis sed corporis.,done,high,2022.10.13 06:34:41
Minus a saepe dicta.,open,high,2022.07.01 03:40:51
Voluptas enim deleniti veritatis.,done,high,2022.10.20 18:07:39
Cum voluptatem consequuntur.,open,high,2023.01.08 09:33:34
Laboriosam repudiandae nulla id impedit.,open,high,2022.03.10 12:01:47
Omnis doloribus numquam.,done,low,2022.04.05 03:58:59
Fugiat alias reiciendis tempore.,open,medium,2022.09.21 06:21:03
Aliquam sint tenetur commodi vitae.,open,medium,2022.05.21 18:22:45
Ipsam laboriosam maxime.,done,high,2022.05.18 03:26:58
Molestiae eius sequi.,open,medium,2022.06.29 19:16:32
Animi omnis eos et.,open,medium,2022.07.17 12:10:04
Illum nulla similique.,done,high,2022.05.26 13:47:46
Molestiae hic accusantium sequi.,done,medium,2022.12.09 23:48:10
Recusandae provident veritatis optio dolor.,done,medium,2022.01.24 23:11:27
Ex nemo tempora sapiente ut.,open,low,2022.08.21 19:39:54
Ipsa beatae dolorem perferendis.,open,low,2022.07.12 19:43:13
Temporibus dignissimos alias perspiciatis beatae.,open,high,2022.08.28 14:44:09
At commodi odit eveniet amet.,done,high,2022.06.14 02:33:17
Consequuntur exercitationem nihil.,done,medium,2022.02.23 16:42:19
Quidem excepturi est.,done,high,2022.08.15 04:21:57
Officiis alias unde similique.,done,low,2022.05.12 01:26:33
Nam quidem qui culpa.,done,high,2022.06.27 01:20:01
Delectus repudiandae vero eveniet.,done,high,2022.10.13 14:22:40
Ut expedita quasi.,done,low,2022.09.20 17:07:02
