name,status,priority,created
Doloremque quisquam ullam repellat.,done,high,2022.10.31 03:50:52
Totam corrupti asperiores vitae.,done,medium,2022.06.12 23:55:18
Aperiam itaque dignissimos ut.,open,medium,2022.07.25 13:41:39
Commodi voluptate minima quia explicabo.,done,low,2022.07.03 23:25:09
Laborum quas placeat.,done,high,2022.11.13 01:27:18
Assumenda dicta odio blanditiis.,done,high,2022.12.01 18:08:07
Deserunt dicta et fuga nulla.,open,medium,2022.03.05 22:50:00
Velit quos ad veritatis.,open,low,2022.02.19 22:42:24
Magni odit suscipit ullam.,done,medium,2022.12.02 04:42:52
Adipisci tenetur ex veniam.,done,medium,2022.01.25 14:37:20
Qui unde voluptate iste.,open,low,2022.05.21 22:25:52
Mollitia illum autem vero.,done,low,2022.04.24 10:53:03
Veniam tempora vero quaerat.,done,low,2022.11.16 10:55:24
Quaerat autem quisquam odio.,done,medium,2022.12.19 07:03:53
Inventore et aliquid.,open,high,2022.07.15 06:04:37
Impedit velit eos.,open,high,2022.11.16 02:49:28
Ea at repellendus expedita quisquam.,open,high,2022.11.30 20:10:27
Laudantium debitis blanditiis.,open,high,2022.03.30 13:02:58
Quas quidem ullam assumenda.,done,high,2022.06.06 23:13:29
Quidem ratione recusandae.,done,high,2022.02.28 11:26:08
Rem in nulla sint illum.,open,medium,2023.01.11 01:51:07
Illum minus architecto.,done,high,2022.01.30 07:10:53
Ipsam magni itaque a tempora.,open,medium,2022.04.17 17:39:32
Eligendi quidem earum suscipit omnis.,done,high,2022.04.18 18:30:25
Ab sequi assumenda.,open,medium,2022.08.25 06:44:22
Quidem incidunt provident.,open,low,2022.09.10 03:28:18
Beatae atque nisi nesciunt tempore.,open,high,2022.06.11 11:28:42
Optio accusantium vel possimus odit.,done,medium,2022.05.25 21:38:44
Repudiandae porro quo amet vero.,done,high,2022.05.26 08:10:52
Impedit corporis ea.,done,low,2023.01.13 21:56:51
Iusto assumenda ullam.,done,medium,2022.05.10 09:34:26
Odit repellat esse expedita provident.,open,high,2022.08.02 14:06:18
Dolor temporibus ipsum voluptatum id.,open,low,2022.08.17 19:19:17
